{
  "declaration_count": 15,
  "declarations": [
    {
      "computed_file_offset_end": 887791,
      "declared_size_bytes": 2982,
      "incbin_path": "bin/music/song10.bin",
      "label": "Song10_HyruleCastle",
      "source_file": "Bank1B.asm",
      "source_file_offset_end": 887791,
      "source_file_offset_start": 884810,
      "source_line": 67,
      "source_range_size_matches": true,
      "source_revision": "347c23f9fc019c72d32da537c9cb235f468d021d"
    },
    {
      "computed_file_offset_end": 889149,
      "declared_size_bytes": 1358,
      "incbin_path": "bin/music/song11.bin",
      "label": "Song11_PendantDungeon",
      "source_file": "Bank1B.asm",
      "source_file_offset_end": 889149,
      "source_file_offset_start": 887792,
      "source_line": 74,
      "source_range_size_matches": true,
      "source_revision": "347c23f9fc019c72d32da537c9cb235f468d021d"
    },
    {
      "computed_file_offset_end": 889908,
      "declared_size_bytes": 759,
      "incbin_path": "bin/music/song12.bin",
      "label": "Song12_Cave",
      "source_file": "Bank1B.asm",
      "source_file_offset_end": 889908,
      "source_file_offset_start": 889150,
      "source_line": 81,
      "source_range_size_matches": true,
      "source_revision": "347c23f9fc019c72d32da537c9cb235f468d021d"
    },
    {
      "computed_file_offset_end": 890620,
      "declared_size_bytes": 712,
      "incbin_path": "bin/music/song13.bin",
      "label": "Song13_Fanfare",
      "source_file": "Bank1B.asm",
      "source_file_offset_end": 890620,
      "source_file_offset_start": 889909,
      "source_line": 88,
      "source_range_size_matches": true,
      "source_revision": "347c23f9fc019c72d32da537c9cb235f468d021d"
    },
    {
      "computed_file_offset_end": 891169,
      "declared_size_bytes": 549,
      "incbin_path": "bin/music/song14.bin",
      "label": "Song14_Sanctuary",
      "source_file": "Bank1B.asm",
      "source_file_offset_end": 891169,
      "source_file_offset_start": 890621,
      "source_line": 95,
      "source_range_size_matches": true,
      "source_revision": "347c23f9fc019c72d32da537c9cb235f468d021d"
    },
    {
      "computed_file_offset_end": 891918,
      "declared_size_bytes": 749,
      "incbin_path": "bin/music/song15.bin",
      "label": "Song15_Boss",
      "source_file": "Bank1B.asm",
      "source_file_offset_end": 891918,
      "source_file_offset_start": 891170,
      "source_line": 102,
      "source_range_size_matches": true,
      "source_revision": "347c23f9fc019c72d32da537c9cb235f468d021d"
    },
    {
      "computed_file_offset_end": 893396,
      "declared_size_bytes": 1478,
      "incbin_path": "bin/music/song16.bin",
      "label": "Song16_CrystalDungeon",
      "source_file": "Bank1B.asm",
      "source_file_offset_end": 893396,
      "source_file_offset_start": 891919,
      "source_line": 109,
      "source_range_size_matches": true,
      "source_revision": "347c23f9fc019c72d32da537c9cb235f468d021d"
    },
    {
      "computed_file_offset_end": 893703,
      "declared_size_bytes": 307,
      "incbin_path": "bin/music/song17.bin",
      "label": "Song17_Shop",
      "source_file": "Bank1B.asm",
      "source_file_offset_end": 893703,
      "source_file_offset_start": 893397,
      "source_line": 116,
      "source_range_size_matches": true,
      "source_revision": "347c23f9fc019c72d32da537c9cb235f468d021d"
    },
    {
      "computed_file_offset_end": 894339,
      "declared_size_bytes": 636,
      "incbin_path": "bin/music/song19.bin",
      "label": "Song19_ZeldaRescue",
      "source_file": "Bank1B.asm",
      "source_file_offset_end": 894339,
      "source_file_offset_start": 893704,
      "source_line": 123,
      "source_range_size_matches": true,
      "source_revision": "347c23f9fc019c72d32da537c9cb235f468d021d"
    },
    {
      "computed_file_offset_end": 895244,
      "declared_size_bytes": 905,
      "incbin_path": "bin/music/song1A.bin",
      "label": "Song1A_CrystalMaiden",
      "source_file": "Bank1B.asm",
      "source_file_offset_end": 895244,
      "source_file_offset_start": 894340,
      "source_line": 130,
      "source_range_size_matches": true,
      "source_revision": "347c23f9fc019c72d32da537c9cb235f468d021d"
    },
    {
      "computed_file_offset_end": 895853,
      "declared_size_bytes": 609,
      "incbin_path": "bin/music/song1B.bin",
      "label": "Song1B_BigFairy",
      "source_file": "Bank1B.asm",
      "source_file_offset_end": 895853,
      "source_file_offset_start": 895245,
      "source_line": 137,
      "source_range_size_matches": true,
      "source_revision": "347c23f9fc019c72d32da537c9cb235f468d021d"
    },
    {
      "computed_file_offset_end": 896194,
      "declared_size_bytes": 341,
      "incbin_path": "bin/music/song1C.bin",
      "label": "Song1C_Suspense",
      "source_file": "Bank1B.asm",
      "source_file_offset_end": 896194,
      "source_file_offset_start": 895854,
      "source_line": 144,
      "source_range_size_matches": true,
      "source_revision": "347c23f9fc019c72d32da537c9cb235f468d021d"
    },
    {
      "computed_file_offset_end": null,
      "declared_size_bytes": null,
      "incbin_path": "bin/music/song1D.bin",
      "label": "Song1D_AgahnimEscapes",
      "source_file": "Bank1B.asm",
      "source_file_offset_end": 896377,
      "source_file_offset_start": 896199,
      "source_line": 170,
      "source_range_size_matches": null,
      "source_revision": "347c23f9fc019c72d32da537c9cb235f468d021d"
    },
    {
      "computed_file_offset_end": null,
      "declared_size_bytes": null,
      "incbin_path": "bin/music/song1F.bin",
      "label": "Song1F_KingOfThieves",
      "source_file": "Bank1B.asm",
      "source_file_offset_end": 897311,
      "source_file_offset_start": 896378,
      "source_line": 177,
      "source_range_size_matches": null,
      "source_revision": "347c23f9fc019c72d32da537c9cb235f468d021d"
    },
    {
      "computed_file_offset_end": null,
      "declared_size_bytes": null,
      "incbin_path": "bin/music/song1E.bin",
      "label": "Song1E_MeetingGanon",
      "source_file": "Bank1B.asm",
      "source_file_offset_end": 897490,
      "source_file_offset_start": 897312,
      "source_line": 184,
      "source_range_size_matches": null,
      "source_revision": "347c23f9fc019c72d32da537c9cb235f468d021d"
    }
  ],
  "format": "zelda-suite-incbin-inventory",
  "format_version": 1,
  "source_file": "Bank1B.asm",
  "source_revision": "347c23f9fc019c72d32da537c9cb235f468d021d"
}
